{
  "$schema": "https://json-schema.org/draft/2020-12/schema",
  "$id": "https://brain-installer/manifest.schema.json",
  "title": "brain install manifest",
  "description": "One manifest per client install. The ONLY thing that differs between installs. Fields marked NOT YET WIRED are read by nothing today; they are kept because they describe intent, but do not tell a client they take effect.",
  "type": "object",
  "required": ["manifest_version", "client", "brain", "infrastructure"],
  "properties": {
    "manifest_version": { "const": 1 },
    "client": {
      "type": "object",
      "required": ["slug", "display_name"],
      "properties": {
        "slug": {
          "type": "string",
          "pattern": "^[a-z0-9][a-z0-9-]{1,40}$",
          "description": "Lowercase. Used to name the worker, the D1 database and the Vectorize index, so it cannot contain spaces or capitals."
        },
        "display_name": { "type": "string", "minLength": 1 },
        "primary_contact": { "type": "string", "format": "email" },
        "timezone": { "type": "string" }
      }
    },
    "brain": {
      "type": "object",
      "required": ["version"],
      "properties": {
        "version": { "type": "string" },
        "worker_name": { "type": "string", "pattern": "^[a-z0-9][a-z0-9-]{1,60}$" },
        "domain": {
          "type": "string",
          "description": "NOT YET WIRED as provisioning. Nothing creates this route; health and test will PROBE it if set, so leave it out until the DNS and route exist or every command will fail against a hostname that does not resolve."
        }
      }
    },
    "infrastructure": {
      "type": "object",
      "required": ["cloudflare"],
      "properties": {
        "cloudflare": {
          "type": "object",
          "required": ["account_id"],
          "properties": {
            "account_id": { "type": "string", "minLength": 8 },
            "storage": {
              "enum": ["d1", "supabase"],
              "default": "d1",
              "description": "d1 keeps the entire brain inside the client's own Cloudflare account and is the standard backend at every corpus size. supabase exists only for migration or an explicitly measured retrieval limitation."
            },
            "d1_database_name": { "type": "string", "description": "Must be scoped to the client, e.g. acme-brain. A bare \"brain\" is refused at provision: it may already exist in the account and belong to something else." },
            "d1_database_id": { "type": "string" },
            "vectorize_index": {
              "type": "string",
              "description": "Created by provision at 768 dimensions, cosine. Those are the output shape of @cf/baai/bge-base-en-v1.5 and are not free choices. Requires the Workers Paid plan."
            },
            "drain_cron": { "type": "string", "default": "*/5 * * * *" },
            "r2_bucket": { "type": "string", "description": "Created by provision, but NOT YET WIRED: nothing binds or reads it." },
            "kv_namespace": { "type": "string", "description": "NOT YET WIRED. Never created, never bound." },
            "kv_namespace_id": { "type": "string" }
          }
        },
        "supabase": {
          "type": "object",
          "properties": {
            "enabled": { "type": "boolean", "default": false },
            "project_ref": { "type": ["string", "null"] }
          }
        }
      }
    },
    "corpora": {
      "type": "object",
      "description": "NOT YET WIRED. No ingest connector ships today, so every field here is dead config. Filling it in does not cause anything to be ingested."
    },
    "retrieval": {
      "type": "object",
      "description": "NOT YET WIRED except answer_model. chunk_size and chunk_overlap are compiled into worker/src/lib/store.js and are not read from here.",
      "properties": {
        "embed_model": { "const": "@cf/baai/bge-base-en-v1.5" },
        "embed_dimensions": { "const": 768 },
        "chunk_size": { "type": "integer" },
        "chunk_overlap": { "type": "integer" },
        "default_result_limit": { "type": "integer", "minimum": 1, "maximum": 50 },
        "answer_model": { "type": "string" },
        "rerank": { "type": "boolean" }
      }
    },
    "safety": {
      "type": "object",
      "properties": {
        "credential_scanner": {
          "type": "object",
          "properties": {
            "enabled": { "type": "boolean", "default": true },
            "gate_version": { "type": "integer" },
            "mode": { "enum": ["refuse", "flag_only"] }
          }
        },
        "private_path_prefixes": {
          "type": "array",
          "items": { "type": "string" },
          "description": "Enforced on LOCAL folder ingest only, per path segment, files and directories. NOT applied to the Drive or Gmail connectors yet: a _private folder in Drive is still ingested. State the limitation to the client."
        },
        "daily_llm_spend_cap_usd": { "type": "number", "minimum": 0 }
      }
    },
    "operations": {
      "type": "object",
      "description": "NOT YET WIRED, all of it. No ingest cron, no health cron, no report email and no webhook are created by any command."
    },
    "testing": {
      "type": "object",
      "properties": {
        "probe_questions": { "type": "array", "items": { "type": "string" } },
        "things_only_they_know": { "type": "array", "items": { "type": "string" } },
        "expected_to_fail": { "type": "array", "items": { "type": "string" } }
      }
    },
    "ingest": { "type": "object" },
    "access": {
      "type": "object",
      "properties": {
        "model": { "const": "single_tenant_all_access" },
        "authorized_emails": {
          "type": "array",
          "items": { "type": "string" },
          "description": "NOT YET WIRED. Read by nothing. Auth is a single admin key: anyone holding it sees everything."
        }
      }
    },
    "handoff": { "type": "object" }
  }
}
